{
  "domain": {
    "version": "0.0.1",
    "chainId": "SN_GOERLI",
    "name": "localhost:3000",
    "revision": "1"
  },
  "message": {
    "address": "0x1c62c52c1709acb3eb9195594e39c04323658463cfe0c641e39b99a83ba11a1",
    "statement": "Starknet enables scalable and secure execution of complex computations on Ethereum, revolutionizing decentralized applications.",
    "uri": "http://localhost:3000",
    "version": "0.0.5",
    "nonce": "dKZKdkSBv2sRAUfdu",
    "issuedAt": "2023-06-27T21:12:25.836Z"
  },
  "primaryType": "Message",
  "types": {
    "Message": [
      {
        "name": "address",
        "type": "felt"
      },
      {
        "name": "statement",
        "type": "string"
      },
      {
        "name": "uri",
        "type": "string"
      },
      {
        "name": "nonce",
        "type": "string"
      },
      {
        "name": "issuedAt",
        "type": "string"
      },
      {
        "name": "version",
        "type": "felt"
      }
    ],
    "StarknetDomain": [
      {
        "name": "name",
        "type": "string"
      },
      {
        "name": "chainId",
        "type": "string"
      },
      {
        "name": "version",
        "type": "string"
      },
      {
        "name": "revision",
        "type": "string"
      }
    ]
  }
}
